title,text,publish_date,url,id
"Faced with rare protests, Cuba curbs social media access, watchdog says","Police run during protests against and in support of the government, amidst the coronavirus disease (COVID-19) outbreak, in Havana, Cuba July 11, 2021. REUTERS/Stringer

Summary

Summary Companies Access to Facebook, WhatsApp, others is restricted -NetBlocks

Sunday protests have largely died down

Dozens still detained - rights group

HAVANA, July 13 (Reuters) - Cuba has restricted access to social media and messaging platforms including Facebook and WhatsApp, global internet monitoring firm NetBlocks said on Tuesday, in the wake of the biggest anti-government protests in decades.

Thousands of Cubans joined demonstrations throughout the Communist-run country on Sunday to protest against a deep economic crisis that has seen shortages of basic goods and power outages. They were also protesting against the government's handling of the coronavirus pandemic and curbs on civil liberties.

loading

Cuba's government has said the demonstrations were orchestrated by counter-revolutionaries financed by the United States, manipulating frustration with an economic crisis largely caused by the decades-old U.S. trade embargo.

Register now for FREE unlimited access to Reuters.com Register

The protests, rare in a country where public dissent is tightly controlled, had largely ended by Sunday evening, as security forces were deployed to the streets and President Miguel Diaz-Canel called on government supporters to go out and fight to defend their revolution.

But another protest flared late Monday in the southern Havana suburb of La Guinera, where one man died and several others, including members of the security forces, were hospitalized with injuries, according to state-run media on Tuesday.

It did not say what caused the death. No other deaths and injuries have been officially confirmed so far.

Hundreds had taken to streets in La Guinera, shouting slogans like 'down with communism,' and 'freedom for the people of Cuba,' according to two residents and video footage seen by Reuters. Some started throwing rocks at security forces who eventually responded with gunfire, said resident Waldo Herrera, 49.

""I think the Communists have lost control, they won't have a solution to this situation,"" he said. ""The people are tired of so much humiliation, so much repression.""

A Reuters witness saw dozens of people carrying sticks departing La Guinera late on Monday.

Activists say the government is using so-called rapid-reaction brigades - government-organized bands of civilian recruits - to counter protesters.

MOBILE INTERNET OUTAGES

They also accuse the government of trying to disrupt communications. Introduced just over two years ago, mobile internet has been a key factor behind the protests, giving Cubans more of a platform to express their frustrations and enabling the word to get out quickly when people are on the street.

In the capital, there have been regular and atypical mobile internet outages since Sunday, according to Reuters witnesses.

NetBlocks, based in London, said on its website that Facebook, WhatsApp, Instagram and Telegram in Cuba were partially disrupted on Monday and Tuesday.

""The pattern of restrictions observed in Cuba indicate an ongoing crackdown on messaging platforms used to organize and share news of protests in real-time,"" said NetBlocks director Alp Toker. ""At the same time, some connectivity is preserved to maintain a semblance of normality.""

Facebook Inc (FB.O), which owns Instagram and WhatsApp, said that it was concerned about its services being restricted in Cuba, in a statement to Reuters late on Tuesday.

""We oppose shutdowns, throttling, and other disruptions of the internet that limit the debate of our community. We hope connectivity will be restored as soon as possible so that Cubans can communicate with family and friends,"" said Joe Osborne, a Facebook spokesperson.

Asked whether the government was intentionally restricting internet connections, Foreign Minister Bruno Rodriguez told a news briefing the situation was ""complicated."" He said power outages could impact telecommunications services and ""Cuba would never renounce the right to defend itself.""

Telegram did not immediately respond to a request for comment. Twitter Inc (TWTR.N) said it found no blocking of its service.

""Our weapon is the internet. If they take away the internet we are unarmed,"" said Havana resident Gino Ocumares, as he tried but failed to connect to the web at a government Wi-Fi hotspot. ""The government does not want people to see the truth.""

'PROVOCATIONS'

The protest in La Guinera was spearheaded by ""antisocial and criminal elements"" that had tried to reach the police station with the aim of attacking its officials and damaging infrastructure, said the state-run Cuban News Agency.

When security forces stopped them, they vandalized homes, set containers on fire, and damaged the suburb's electricity wiring, attacking officials with stones and other objects, the agency said.

State-run media also reported on Tuesday that Raul Castro, who stepped down as head of the ruling Cuban Communist Party in April, attended a meeting on Sunday of the political bureau to address the ""provocations.""

Diaz-Canel said in April he would continue to consult Castro on matters of utmost importance.

The Cuban Bishops Conference said in a statement it was worried that the response to protests over legitimate concerns would be ""immobilism"" rather than an attempt to resolve them, and even a counterproductive hardening of positions.

Reaction to the protest in Latin America split along ideological lines, with Mexico's president blaming the U.S. embargo for fomenting the unrest, while Chile and Peru urged the government to allow pro-democracy protests.

U.S. President Joe Biden said on Monday that the United States ""stands firmly with the people of Cuba as they assert their universal rights.""

State Department spokesman Ned Price called on the Havana government to open all means of communication, both online and offline.

""Shutting down technology, shutting down information pathways - that does nothing to address the legitimate needs and aspirations of the Cuban people,"" Price told a news briefing on Tuesday.

Register now for FREE unlimited access to Reuters.com Register

Reporting by Sarah Marsh in Havana and Elizabeth Culliford in New York; Additional reporting by Nelson Acosta and Reuters TV in Havana, Simon Lewis in Washington and Sheila Dang in New York, Juby Babu in Bengaluru; Editing by Richard Chang and Rosalba O'Brien

Our Standards: The Thomson Reuters Trust Principles.",2021-07-13 00:00:00,https://www.reuters.com/world/americas/cuba-curbs-access-facebook-messaging-apps-amid-protests-internet-watchdog-2021-07-13/,42
Protests across Tunisia target Ennahda party over political crisis,"TUNIS, July 25 (Reuters) - Police and protesters clashed in several Tunisian cities on Sunday as demonstrators demanding the government step down attacked offices of Ennahda, the moderate Islamist party that is the biggest in parliament.

Witnesses said protesters stormed or tried to storm Ennahda offices in Monastir, Sfax, El Kef and Sousse, while in Touzeur they set fire to the party's local headquarters.

The violence came as hundreds of protesters rallied in each of the main cities after a spike in COVID-19 cases that has aggravated economic troubles and exposed the failings of a squabbling political class.

Register now for FREE unlimited access to Reuters.com Register

The protests, the biggest in Tunisia for months and the biggest to target Ennahda for years, were called by social media activists. No political parties publicly backed the rallies.

In Tunis, police used pepper spray against protesters who threw stones and shouted slogans demanding that Prime Minister Hichem Mechichi quit and parliament be dissolved. There were other big protests in Gafsa, Sidi Bouzid and Nabeul.

The protests raise pressure on a fragile government that is enmeshed in a political struggle with President Kais Saied, as the government tries to avert a looming fiscal crisis amid a weeks-long spike in COVID-19 cases and increased death rates.

The pandemic has hammered the economy which was already struggling in the aftermath of the 2011 revolution that ousted long-time authoritarian leader Zine al-Abidine Ben Ali.

1/3 Demonstrators gather in front of police officers standing guard during an anti-government protest in Tunis, Tunisia, July 25, 2021. REUTERS/Zoubeir Souissi Read More

Public support for democracy has waned amid surging unemployment and crumbling state services.

""Our patience has run out... there are no solutions for the unemployed,"" said Nourredine Selmi, 28, a jobless protester. ""They cannot control the epidemic ... They can't give us vaccines.""

Last week, Mechichi sacked the health minister after chaotic scenes at walk-in vaccination centres during the Muslim Eid al-Adha holiday, where large crowds queued for inadequate supplies of vaccine.

After a year of wrangling with Mechichi and the leader of Ennahda, Rached Ghannouchi, who is also parliament speaker, President Saied declared the army would take over the pandemic response.

Some analysts saw the move as an attempt to expand his powers beyond the foreign and military role assigned to the president in the 2014 constitution.

Ennahda, banned before the revolution, has been the most consistently successful political party since then and a member of successive government coalitions. It has backed Mechichi, a political independent, in his disputes with the president.

""The message of anger was well received... but violence and burning are unacceptable,"" said party official Maher Mahioub.

Government paralysis could derail efforts to negotiate an International Monetary Fund loan seen as crucial to stabilising state finances but which could also involve spending cuts that would aggravate economic pain for ordinary people.

Register now for FREE unlimited access to Reuters.com Register

Reporting by Tarek Amara; Writing by Angus McDowall; Editing by Edmund Blair

Our Standards: The Thomson Reuters Trust Principles.",2021-07-25 00:00:00,https://www.reuters.com/world/africa/protests-across-tunisia-covid-19-surges-economy-suffers-2021-07-25/,43
Key Kazakh oilfield hit by protests,"LONDON, Jan 6 (Reuters) - Oil production at Kazakhstan's top field Tengiz was reduced on Thursday, its operator Chevron (CVX.N) said, as some contractors disrupted train lines in support of protests taking place across the central Asian country.

Demonstrations in the west of the country against a New Year's Day fuel price hike have quickly grown into deadly anti-government riots with Russia sending in paratroopers to put down the countrywide uprising. read more

Kazakhstan is a major oil producer with output of about 1.6 million barrels per day (bpd) in recent months, and has rarely seen production disrupted by unrest or natural disaster.

Register now for FREE unlimited access to Reuters.com Register

""TCO production operations continue, however, there has been a temporary adjustment to output due to logistics,"" Chevron, the largest foreign oil producer in Kazakhstan with a 50% stake in the Tengizchevroil (TCO) joint venture, said in a statement.

Protestors at the field have disrupted train activity which is used to export oil, sources told Reuters.

TCO produces around 700,000 bpd. It was not clear by how much output has been reduced. Other top fields in Kazakhstan are onshore Karachaganak and offshore Kashagan.

Besides Chevron, the three key projects involve most top foreign companies including Exxon Mobil, Lukoil, Royal Dutch Shell (RDSa.L), Eni, TotalEnergies (TTEF.PA), CNPC and Inpex.

A Shell spokesperson said production at the Karachaganak and Kashagan ventures was continuing.

""We are following developments in Kazakhstan closely. We are focusing on keeping our people and operations safe, working closely with our venture partners... We are keeping the situation under constant review.""

Register now for FREE unlimited access to Reuters.com Register

Reporting by Rowena Edwards and Ron Bousso, additional reporting by Dmitry Zhdannikov; editing by David Goodman, Jason Neely, Kirsten Donovan

Our Standards: The Thomson Reuters Trust Principles.",2022-01-06 00:00:00,https://www.reuters.com/business/energy/chevron-says-production-continues-kazakhstan-oil-venture-2022-01-06/,44
"Ahead of planned protests, Cuban government and dissidents wage 'battle of ideas'","Protesters shout slogans against the government during a demonstration, which also involved counter-protesters who are in support of the government, amidst the coronavirus disease (COVID-19) outbreak, in Havana, Cuba July 11, 2021. REUTERS/Alexandre Meneghin/File Photo

HAVANA, Nov 10 (Reuters) - A war of words fought in the media and rife with espionage - double agents, wire taps and hidden cameras - is raging in Cuba ahead of protests planned for Nov. 15, setting up a showdown between the government and a dissident movement that says its most potent weapon is the cellphone.

Dissidents in September requested permission to conduct a ""Civic March for Change"" in mid-November, following widespread protests on the island in July. The Communist-run government denied that request last month, but protesters say they plan to go ahead anyway.

The government has since launched a media campaign employing tactics favored by former Cuban leader Fidel Castro, leveraging the state security forces to unearth evidence it says proves the organizers are working covertly with the United States to overthrow the government, a charge the protest leaders deny.

Register now for FREE unlimited access to Reuters.com Register

Historians and long-time Cuba watchers say Nov. 15 will mark the first real test of the government's Cold War-era strategies against a movement that is younger and more internet savvy than any before it.

""Clearly, they've reverted to their old playbook,"" said Paul Hare, a former British ambassador to Cuba during the so-called ""Black Spring"" in 2003 when Castro jailed 75 dissidents.

But with more Cubans online than ever before, it has become more difficult for the government to dominate the airwaves, Hare said. ""They've lost the narrative, the battle of ideas, especially with young people.""

A Cuban government spokesperson rejected that argument.

""In Cuba, there is another youth, with many other viewpoints, the majority of which are not considered by international media,"" the spokesperson said.

The stakes for Cuba are high, said historian Michael Bustamante of the University of Miami. Protesters plan to march the same day that Cuba reopens its doors to international tourism after a nearly two-year hiatus during the coronavirus pandemic. Tourist revenue is vital to Cuba's ailing economy.

""This is the moment where the Cuban state is looking to turn the corner on what has been a very bad year... and here you have this group saying 'no, we are choosing this specific moment to press for political change',"" said Bustamante.

""I think that explains the intensity of the state's response.""

SPYCRAFT

The call for protests is being led by a Facebook group called Archipielago. It said in a Nov. 3 post on the platform that it has 31,501 members, the majority of which are between 25 and 44 years old.

In a barrage of primetime television news programs on state-run channels, Cuba's government has used spycraft to question the motives of Yunior Garcia, a Cuban playwright who is the leader of Archipielago.

In a dramatic TV segment aired last week, a cancer doctor in hospital scrubs revealed he was really 'Agente Fernando,' a double-agent who for 25 years infiltrated the dissident movement and accompanied Garcia to a workshop to discuss the Cuban military's role in promoting a transition to democracy.

""Yunior Garcia Aguilera is looking for a confrontation between the armed forces and the people,"" Fernando told viewers of the program.

Reuters was unable to reach Fernando, whose real name is Dr. Carlos Leonardo Vazquez, for comment.

Garcia told Reuters he recalls Fernando at the workshop but rejected any suggestion he was seeking to violently overthrow the government.

He said he has never taken U.S. funds.

""It is very difficult for the regime to admit that it has deployed all its forces against a group of young people on phones,"" Garcia said in an interview at his home in Havana. ""They are scared of a public that no longer believes in them and that isn't afraid to say so on social media.""

Garcia says Cuban authorities have thus leaned on an age-old strategy: blaming the United States.

In another segment, state-run TV aired a phone call in which Ramon Saul Sanchez, a Miami-based exile whom Cuba accuses of being behind a series of terror attacks decades ago, appears to pledge support to Garcia and asks whether he should send a flotilla of boats into waters near Cuba on the day of the planned protests. Garcia is reluctant.

Garcia confirmed the call took place and said it was recorded without his knowledge.

Sanchez, who has denied the terror attack accusations, did not immediately respond to a request for comment.

The Cuban government has said their evidence points to a movement that is looking to topple the leadership and is backed by outsiders.

Such subterfuge is not without precedent. A 1975 U.S. Senate committee report revealed attempts by U.S. spies to kill Castro using ""devices that strain the imagination,"" including exploding cigars and poison pills. As recently as 2009, the United States backed efforts to create a ""Cuban Twitter"" to stir unrest on the island.

Nearly half of Archipielago members reside outside of Cuba, according to figures provided by the group. Around one-quarter live in the United States.

The U.S. State Department did not immediately reply to a request for comment. In late October, a department spokesman said the United States supports the right of Cubans to protest but that the rallies were not a ""demonstration... of the desires of the United States government.""

The U.S. government has threatened sanctions amid a wave of arrests following the July 11 protests, believed to be the largest since Castro's 1959 revolution. Cuban authorities say those arrested were guilty of crimes including public disorder, resisting arrest, and vandalism.

Many who have publicly advocated for protests say they have been harassed or put on notice by state security and government supporters in a bid to keep them off the streets next Monday.

It is not clear how many plan to march on Nov. 15, either at home or abroad, nor what the Cuban government's response will be.

""I think the question is whether Cuba can put the July 11 genie back in the bottle or not,"" said Bustamante. ""November 15 will be one measure of that.""

Register now for FREE unlimited access to Reuters.com Register

Reporting by Dave Sherwood and Marc Frank, additional reporting by Nelson Acosta Editing by Daniel Flynn and Rosalba O'Brien

Our Standards: The Thomson Reuters Trust Principles.",2021-11-10 00:00:00,https://www.reuters.com/world/americas/ahead-planned-protests-cuban-government-dissidents-wage-battle-ideas-2021-11-10/,45
"Taliban response to Afghan protests increasingly violent, UN says","GENEVA, Sept 10 (Reuters) - The U.N. rights office on Friday said that the Taliban response to peaceful marches in Afghanistan has been increasingly violent, with authorities using live ammunition, batons and whips and causing the deaths of at least four protesters.

Protests and demonstrations, often led by women, pose a challenge to the new Islamist Taliban government as it seeks to consolidate control after seizing the capital Kabul nearly a month ago. read more

""We have seen a reaction from the Taliban which has unfortunately been severe,"" Ravina Shamdasani, U.N. rights spokesperson, told a briefing in Geneva, saying the United Nations had documented four protester deaths from gunfire.

Register now for FREE unlimited access to Reuters.com Register

Taliban forces try to stop the protesters, as they shout slogans during an anti-Pakistan protest, near the Pakistan embassy in Kabul, Afghanistan, September 7, 2021. REUTERS/Stringer

However, she said that some or all may have resulted from efforts to disperse protesters with firing.

She added that the United Nations had also received reports of house-to-house searches for those who participated in the protests. Journalists covering the protests have also been intimidated.

""In one case, one journalist was reported to have been told, as he was being kicked in the head, 'You are lucky you haven't been beheaded',"" Shamdasani said. ""Really there has been lots of intimidation of journalists simply trying to do their job.""

Register now for FREE unlimited access to Reuters.com Register

Reporting by Emma Farge; Editing by Douglas Busvine and Kevin Liffey

Our Standards: The Thomson Reuters Trust Principles.",2021-09-10 00:00:00,https://www.reuters.com/business/media-telecom/taliban-response-afghan-protests-increasingly-violent-un-says-2021-09-10/,46
Canada's Trudeau 'not intimidated' by truckers' COVID protest,"Summary Protesters say they are in for long haul

Trudeau tests positive for COVID-19

OTTAWA, Jan 31 (Reuters) - Prime Minister Justin Trudeau on Monday said Canadians were disgusted by the behavior of some people protesting against COVID-19 vaccine mandates in Ottawa and said he would not be intimidated.

Dozens of trucks and other vehicles have jammed up the city center since Friday. Thousands descended upon Parliament Hill to complain about Trudeau, COVID-19 vaccine mandates and masking requirements but by mid-Monday afternoon, many had left.

Police said most demonstrators have been peaceful but local residents complained about blaring truck horns and some demonstrators using the streets as a toilet. Some also harassed a homeless shelter and demanded staff give them food - the shelter said on Twitter - while others flew Nazi flags.

Register now for FREE unlimited access to Reuters.com Register

""We are not intimated by those who hurl abuse at small business workers and steal food from the homeless,"" Trudeau told a news conference.

""We won't cave to those who engage in vandalism ... There is no place in our country for threats, violence, or hatred.""

Senior members of the official opposition Conservative Party, which last year lost its third consecutive election to Trudeau's Liberals, praised the demonstrators.

Trudeau said Conservative leader Erin O'Toole should ""reflect very carefully on how he's walking a path that supports these people who do not represent truckers.""

But the Conservatives say Trudeau is ignoring the pain of thousands fighting for their livelihoods.

""(Canada) is a raw nerve and the prime minister is jumping up and down on it again and again with his inflammatory rhetoric,"" finance spokesman Pierre Poilievre told the House of Commons.

1/5 Vehicles displaying protest signs are seen outside Parliament Hill, as demonstrations by truckers and their supporters against the coronavirus disease (COVID-19) vaccine mandates continue, in Ottawa, Ontario, Canada, January 31, 2022. REUTERS/Blair Gable Read More

Trudeau earlier announced he had contracted COVID-19 but felt fine and would work remotely. For security reasons he was moved to an unspecified location on Saturday.

'AS LONG AS IT TAKES'

Ottawa police chief Peter Sloly told reporters the number of protestors had fallen significantly from Sunday and said negotiations with organizers were continuing to ensure the rest left as soon as possible.

""All options are on the table, (from) negotiation through to enforcement ... we are making real progress,"" he said.

One of the groups involved said it wanted people to go into a mall and shop without masks. The Rideau Centre, a large nearby mall, said it would be shut for a second day on Monday.

The demonstration started as a protest against a vaccine requirement for cross-border drivers, but then developed into a demonstration against Trudeau and COVID-19 policies in general.

Trucking executives say around 90% of drivers have been inoculated. The Conservatives argue the vaccine mandate is causing shortages of food imported from the United States.

Transport Minister Omar Alghabra told reporters that ""this mandate has not had a measurable impact on the volume of traffic crossing our borders.""

Truck driver Marian Tudor said he could no longer haul goods across the border because he is unvaccinated.

Tudor, 61, said he was willing to stay ""as long as it takes, until we get these mandates removed for everybody."" He accused the government of using ""fake science.""

Register now for FREE unlimited access to Reuters.com Register

Additional reporting by Ismail Shakil in Bengaluru; Editing by Aurora Ellis and Alistair Bell

Our Standards: The Thomson Reuters Trust Principles.",2022-01-31 00:00:00,https://www.reuters.com/world/americas/police-say-ottawa-truck-protest-dwindle-demonstrators-remain-stubborn-2022-01-31/,47
