title,text,publish_date,url,id
"Kazakh president fails to quell protests, ex-Soviet states offer help","Summary

Summary Companies Protesters set buildings alight in anger at ex-leader

Fuel price rise first triggered demonstrations

Russia-led security alliance to send peacekeeping force

ALMATY, Jan 6 (Reuters) - A Russia-led security alliance of ex-Soviet states will send peacekeeping forces to Kazakhstan, Armenia's prime minister said on Thursday, after the Kazakh president appealed for their help in quelling violent and deadly protests.

Armenian Prime Minister Nikol Pashinyan said on Facebook that an unspecified number of peacekeepers would go to Kazakhstan for a limited period to stabilise the situation after state buildings were torched and the Almaty international airport was seized.

Eight police and national guard troops were killed in the unrest on Tuesday and Wednesday, Russia's state-owned Sputnik agency quoted the Kazakh interior ministry as saying on Wednesday. Russian news agencies, quoting Kazakh media, later said two soldiers had also been killed in what they described as an anti-terrorist operation at Almaty airport.

Register now for FREE unlimited access to Reuters.com Register

Initially sparked by anger at a fuel price rise, the protests have quickly spread to take in wider opposition to President Kassym-Jomart Tokayev's predecessor Nursultan Nazarbayev, who retained significant power despite quitting in 2019 after a nearly three-decade rule.

Nazarbayev, 81, has been widely seen as the main political force in Nur-Sultan, the purpose-built capital which bears his name. His family is believed to control much of the economy, the largest in Central Asia. He has not been seen or heard from since the protests began.

The Central Asian nation's reputation for stability under Nazarbayev helped attract hundreds of billions of dollars of foreign investment in its oil and metals industries.

But a younger generation is demanding the liberalisation seen in other former satellite states of the Soviet Union. The protests are the worst in Kazakhstan - a country five times the size of France with a population of nearly 19 million people - in over a decade.

Apparently seeking to appease public ire, Tokayev sacked Nazarbayev as head of the powerful Security Council on Wednesday, and took it over himself. He also appointed a new head of the State Security Committee, successor to the Soviet-era KGB, and removed Nazarbayev's nephew from the No. 2 position on the committee.

Tokayev's Cabinet also resigned.

But protests continued, with demonstrators taking control of the airport in Almaty, Kazakhstan's biggest city, a source familiar with the matter told Reuters. Flights were cancelled.

Interfax quoted an official as saying the airport had subsequently been cleared of protesters. Reuters was not able to independently confirm the report.

Earlier, riot police used teargas and flash grenades against protesters in Almaty but then appeared to withdraw.

A SECOND TOKAYEV TV APPEARANCE

1/7 Kazakh law enforcement officers block a street during a protest triggered by fuel price increase in Almaty, Kazakhstan January 5, 2022. REUTERS/Pavel Mikheyev Read More

In the early hours of Thursday, in his second televised speech within hours, Tokayev said that he had appealed for help to the Collective Security Treaty Organization (CSTO), a military alliance of Russia, Armenia, Belarus, Kazakhstan, Kyrgyzstan, and Tajikistan.

He said foreign-trained ""terrorist"" gangs were seizing buildings, infrastructure and weapons, and had taken five aircraft, including foreign ones, at Almaty airport.

""It is an undermining of the integrity of the state and most importantly it is an attack on our citizens who are asking me... to help them urgently,"" Tokayev said.

""Almaty was attacked, destroyed, vandalised, the residents of Almaty became victims of attacks by terrorists, bandits. Therefore it is our duty... to take all possible actions to protect our state.""

Russian news agencies quoted Dmitry Rogozin, head of the Russian space agency Roscosmos, as saying security had been strengthened around key installations at the Baikonur Cosmodrome in Kazakhstan, which Russia uses for space launches.

'COMPLETE ANARCHY'

A resident of Almaty who mingled with the protesters on Wednesday said most of those he met appeared to come from the city's impoverished outskirts or nearby villages.

At the main square, vodka was being distributed and some people were discussing whether to head towards the city bazaar or a wealthy area for possible looting, the resident said.

""There is complete anarchy in the street,"" he said.

Footage posted on the internet showed protesters chanting below a giant bronze statue of Nazarbayev, strung with ropes in an apparent attempt to pull it down. A woman who posted it said it was filmed in the eastern city of Taldykorgan.

Early on Wednesday, Reuters journalists had seen thousands of protesters pressing towards Almaty city centre, while in the city of Aqtobe, protesters gathered shouting: ""Old Man, go away!"" A video online showed police using water cannon and stun grenades near the mayor's office.

States of emergency were declared in Nur-Sultan, Almaty, and westerly Mangistau province. The internet was shut down.

After accepting the Cabinet's resignation, Tokayev ordered acting ministers to reverse the fuel price rise, which doubled the cost of liquefied petroleum gas widely used for vehicles in Kazakhstan.

The Kremlin has said it expected Kazakhstan, a close ally, to quickly resolve its internal problems, warning other countries against interfering. White House press secretary Jen Psaki said Russian accusations that the United States had instigated the unrest were false.

Register now for FREE unlimited access to Reuters.com Register

Reporting by Olzhas Auyezov, Pavel Mikheyev, Maria Gordeyeva, Tamara Vaal and Karin Strohecker; Writing by Mark Trevelyan, Andrew Cawthorne and Rosalba O'Brien; Editing by Howard Goller

Our Standards: The Thomson Reuters Trust Principles.",2022-01-05 00:00:00,https://www.reuters.com/markets/commodities/kazakhstan-government-resigns-after-violent-protests-over-fuel-price-2022-01-05/,0
Cuba sees biggest protests for decades as pandemic adds to woes,"HAVANA, July 11 (Reuters) - Chanting ""freedom"" and calling for President Miguel Diaz-Canel to step down, thousands of Cubans joined street protests from Havana to Santiago on Sunday in the biggest anti-government demonstrations on the Communist-run island in decades.

The protests erupted amid Cuba's worst economic crisis since the fall of the Soviet Union, its old ally, and a record surge in coronavirus infections, with people voicing anger over shortages of basic goods, curbs on civil liberties and the authorities' handling of the pandemic.

Thousands took to the streets in various parts of Havana including the historic centre, their shouts of “Diaz-Canel step down” drowning out groups of government supporters waving the Cuban flag and chanting ""Fidel.""

Register now for FREE unlimited access to Reuters.com Register

Special forces jeeps, with machine guns mounted on the back were seen throughout the capital and the police presence was heavy even long after most protesters had gone home by the 9 p.m. curfew in place due to the pandemic.

""We are going through really difficult times,"" Miranda Lazara, 53, a dance teacher, who joined the thousands of protesters who marched through Havana. ""We need a change of system.""

Diaz-Canel, who also heads the Communist Party, blamed the unrest on old Cold War foe the United States, which in recent years tightened its decades-old trade embargo on the island, in a televised speech on Sunday afternoon.

Diaz-Canel said many protesters were sincere but manipulated by U.S.-orchestrated social media campaigns and “mercenaries” on the ground, and warned that further “provocations” would not be tolerated, calling on supporters to confront “provocations.""

The president was due to make another address to the nation at 9 a.m. on Monday, according to state-run media.

Julie Chung, acting undersecretary of the U.S. State Department's Office of Western Hemisphere Affairs, said it was deeply concerned by “calls to combat” in Cuba and stood by the Cuban people’s right for peaceful assembly.""

Reuters witnesses in Havana protests saw security forces, aided by suspected plain clothes officers, arrest about two dozen protesters. Police used pepper spray and hit some protesters as well as a photographer working for the Associated Press.

In one area of Havana, protesters took out their anger on an empty police car, rolling it over and then throwing stones at it. Elsewhere, they chanted ""repressors"" at riot police.

Some protesters said they went on to the streets to join in after seeing what was happening on social media, which has become an increasingly important factor since the introduction of mobile internet two and a half years ago, although connections were patchy on Sunday.

NATIONWIDE PROTESTS

1/5 People shout slogans against the government during a protest against and in support of the government, amidst the coronavirus disease (COVID-19) outbreak, in Havana, Cuba July 11, 2021. REUTERS/Alexandre Meneghini Read More

The Caribbean island nation of 11 million inhabitants where public dissident is usually restricted has seen a growing number of protests over the past year although nothing on this scale or simultaneously in so many cities.

The anti-government demonstrations were the largest since the summer of 1994, said Michael Bustamante, an assistant professor of Latin American history at Florida International University.

""Only now, they weren't limited to the capital; they didn't even start there, it seems,"" he said.

Sunday's demonstrations broke out at around midday in San Antonio de los Banos municipality in Artemisa Province, bordering Havana. Video on social media showed hundreds of residents chanting anti-government slogans and demanding everything from coronavirus vaccines to an end of daily blackouts.

“I just walked through town looking to buy some food and there were lots of people there, some with signs, protesting,” resident Claris Ramirez said by phone. “They are protesting blackouts, that there is no medicine"".

President Diaz-Canel visited the town, later saying in his broadcast remarks: ""We are calling on all the revolutionaries in the country, all the Communists, to hit the streets wherever there is an effort to produce these provocations"".

There were protests later on Sunday hundreds of miles to the east in Palma Soriano, Santiago de Cuba, where social media video showed hundreds marching through the streets, again confirmed by a resident.

“They are protesting the crisis, that there is no food or medicine, that you have to buy everything at the foreign currency stores, and on and on the list goes,” the resident, Claudia Perez, said.

The protests in Havana started around 3 p.m. and fizzled out around 8 p.m., with some protesters giving up after security forces thwarted their attempt to reach Revolution Square

Cuba has been experiencing a worsening economic crisis for two years, which the government blames mainly on U.S. sanctions and the pandemic, while its detractors cite incompetence and a Soviet-style one-party system.

A combination of sanctions, inefficiencies and the pandemic has shut down tourism and slowed other foreign revenue flows in a country dependent on them to import the bulk of its food, fuel and inputs for agriculture and manufacturing.

The economy contracted 10.9% last year, and 2% through June of 2021. The resulting cash crunch has spawned shortages that have forced Cubans to queue for hours for basic goods throughout the pandemic.

Cuba has begun a mass vaccination campaign, with 1.7 million of its 11.2 million residents vaccinated to date and twice that many have received at least one shot in the three-shot process.

Still, the arrival of the Delta variant has prompted cases to surge, with health authorities reporting a record 6,923 cases and 47 deaths on Sunday - twice as many as the previous week. Hospitals in the worst affected province have been overwhelmed.

Register now for FREE unlimited access to Reuters.com Register

Reporting by Marc Frank, Sarah Marsh and Reuters TV in Havana; Additional reporting by Nelson Acosta; Editing by Chizu Nomiyama, Peter Cooney & Simon Cameron-Moore

Our Standards: The Thomson Reuters Trust Principles.",2021-07-11 00:00:00,https://www.reuters.com/world/americas/street-protests-break-out-cuba-2021-07-11/,1
Myanmar marks coup anniversary with protests and unrest,"Summary Protesters and military supporters mark anniversary

Junta extends state of emergency to thwart 'saboteurs'

Explosion at pro-army rally kills 2 - witnesses

Calls grow for global halt on arms sales to junta

Man sets himself on fire to protest power outages

Feb 1 (Reuters) - Streets in some of Myanmar's main cities were nearly deserted on Tuesday as opponents of military rule held ""silent strikes"", marking the first anniversary of a coup that led to deadly chaos and snuffed out tentative steps towards democracy.

The United States, Britain and Canada imposed new sanctions on the military and joined other countries in calling for a global halt in arms sales to Myanmar, a year after Nobel laureate Aung San Suu Kyi's elected government was overthrown.

Since its bloody suppression of protests in the weeks following the coup, the military has faced armed resistance on multiple fronts in the countryside from groups allied with the ousted government.

Register now for FREE unlimited access to Reuters.com Register

On Tuesday, an explosion took place during a procession of military supporters in the eastern border town of Tachileik, two witnesses told Reuters. The blast killed two people, said one of the witnesses, and wounded more than 30 others.

State media on Tuesday said junta chief Min Aung Hlaing extended a state of emergency for a further six months to address threats from ""internal and external saboteurs"" and ""terrorist attacks and destruction"".

Activists urged people to stay indoors and businesses to close in a silent show of defiance, despite warnings of arrests, jail and a seizure of businesses.

""We might be arrested and spend our life in jail if we're lucky. We might be tortured and killed if we're unlucky,"" saidyouth activist Nan Lin.

A military spokesman did not respond to telephone calls seeking comment on Tuesday.

STREETS QUIET

Images on social media showed quiet streets in various cities including Mandalay, Magway, Myitkyina and Yangon, where pictures on a page put up by strike organisers later showed a small protest at which people threw red paint on the ground.

A man set himself on fire in the central town of Kyaukdataung and was in a serious condition in hospital, according to a resident and to local news outlets, which said the man was protesting at intermittent power supplies.

""He set fire to himself at the Main Street in front of the electricity office,"" a resident told Reuters by phone. ""He is in a serious condition. The situation is quite unstable here today.""

There were also pro-junta events in several locations, including the capital, Naypyitaw, where thousands attended a rally, some dancing and holding aloft photographs of Min Aung Hlaing, with banners wishing him good health.

The was no claim of responsibility for the explosion in Tachileik and a local militia group did not immediately respond to a request for comment. The town's news agency said a soldier was among the two killed, and veterans among the wounded.

""We all heard an explosion and people ran randomly, shouting loudly,"" a witness told Reuters by phone. ""I hid inside the house.""

1/2 A Myanmar soldier looks on as he stands inside city hall after soldiers occupied the building, in Yangon, Myanmar February 2, 2021. REUTERS/Stringer Read More

Another witness told Reuters two people died instantly and the town was now deserted.

HUGE BACKLASH

Such violence has become commonplace in Myanmar in the year since Suu Kyi and other ruling party members were arrested as they prepared to take their seats in parliament, after winning a 2020 election the generals accused them of rigging.

The coup triggered a huge backlash, with strikes and protests that led to about 1,500 civilians being killed in crackdowns and more than 11,787 unlawfully held, according to United Nations human rights office figures on Tuesday.

A junta spokesman did not respond to calls seeking comment on the U.N. figures. It has previously disputed similar numbers from human rights groups.

The U.N. human rights expert on Myanmar, Tom Andrews, on Tuesday said the junta was functioning like a criminal enterprise, harming its people and stealing their resources.

""The international community must take strong, meaningful steps to cut the junta's access to weapons, funds and legitimacy,"" Andrews said.

The military has accused the U.N. of bias and interference and is refusing to bow to international pressure, despite a corporate retreat from Myanmar and sanctions. read more

The military ruled for decades after a 1962 coup but had begun to withdraw from politics in 2010, freeing Suu Kyi after years of house arrest.

Her party formed a government after a 2015 election, but was required to share power with the army until the military abruptly ended the experiment with reform a year ago.

Life has become a grind for many since then with the economy withering, regular power cuts and internet curbs.

Suu Kyi, 76, is on trial in more than a dozen cases that carry a combined maximum sentence of more than 150 years in prison.

An internationally backed diplomatic effort led by Southeast Asian countries has faltered.

""It's very lamentable, until this time there has not been significant progress,"" Indonesia's foreign ministry said.

Singapore said conditions for the Myanmar people continued to deteriorate and called for progress and Suu Kyi's release.

(This story corrects typographical error in paragraph 1 and adds missing word in paragraph 11)

Register now for FREE unlimited access to Reuters.com Register

Reporting by Reuters Staff Writing by Ed Davies; Editing by Martin Petty, Robert Birsel and Alex Richardson

Our Standards: The Thomson Reuters Trust Principles.",2022-02-01 00:00:00,https://www.reuters.com/world/asia-pacific/myanmar-activists-vow-defy-junta-with-strike-coup-anniversary-2022-02-01/,2
Canada rules out use of troops against truckers' blockade; more protests planned,"OTTAWA, Feb 3 (Reuters) - The Canadian government will not use troops against truckers whose nearly week-long protest of coronavirus vaccine mandates has brought traffic in central Ottawa to a halt, Prime Minister Justin Trudeau said on Thursday.

More than 200 trucks and other vehicles have been blockading downtown roads in the nation's capital since last Friday in what is an unprecedented protest by Canadian standards.

Organizers say drivers plan to hold similar protests in Toronto, the country's most populous city and its financial hub, and Quebec City later this week amid growing frustration over almost two years of restrictions imposed to fight COVID-19.

Register now for FREE unlimited access to Reuters.com Register

Ottawa residents are angry that local police are largely watching the demonstrations rather than moving in to break them up. The city's police chief on Wednesday indicated guns were being smuggled into the protest and said using the military was an option, but Trudeau dismissed the idea.

""There is no question of sending in the army,"" the prime minister said.

Some demonstrators want an end to a federal COVID-19 vaccine mandate for cross-border truckers while others insist Trudeau be removed from power on the grounds he exceeded his authority.

Protest organizer Tamara Lich said the demonstrators would stay in place until all mandates had been dropped.

""Our movement has grown in Canada and across the world because common people are tired of the mandates and restrictions in their lives that now seem to be doing more harm than good,"" she told a news conference.

A few people on Ottawa streets have brandished Nazi flags, harassed minorities and threatened reporters.

1/4 A person hold a sign as truckers and supporters continue to protest coronavirus disease (COVID-19) vaccine mandates, in Ottawa, Ontario, Canada February 3, 2022. REUTERS/Patrick Doyle Read More

""That is unacceptable. It's time for these people to go home,"" Trudeau told reporters.

Ottawa police, who have made just three arrests so far, issued 30 traffic tickets on Wednesday.

The protesters have raised more than C$10 million ($7.9 million) on the crowdfunding platform GoFundMe, which has suspended disbursements while it checks on how the money is being spent.

Legislators on the House of Commons public safety committee voted on Thursday to summon GoFundMe representatives to testify about what safeguards it has in place when it comes to releasing the funds.

'LESSONS TO BE LEARNED'

Quebec Premier Francois Legault said authorities would not tolerate any mayhem related to protests. Quebec City Mayor Bruno Marchand told a radio station that ""there are lessons to be learned from Ottawa.""

Trudeau's Liberals look set to benefit politically from the protests, which have split the official opposition Conservative Party. Federal Conservative lawmakers ousted leader Erin O'Toole on Wednesday, citing his poor performance in an election defeat to the Liberals last September and his initial, lukewarm support for the protests.

Former Conservative leader Andrew Scheer and other parliamentarians later posed with truckers, a move Ottawa Mayor Jim Watson branded ""an absolute disgrace.""

($1 = 1.2681 Canadian dollars)

Register now for FREE unlimited access to Reuters.com Register

Additional reporting by Allison Lampert in Montreal and Steve Scherer in Ottawa; Editing by Bill Berkrot and Paul Simao

Our Standards: The Thomson Reuters Trust Principles.",2022-02-03 00:00:00,https://www.reuters.com/world/americas/canada-has-no-plans-use-troops-deal-with-ottawa-protest-pm-trudeau-2022-02-03/,3
Salvador street protest breaks out against bitcoin adoption,"A person holds a sign that reads 'The Bitcoin bill must be repealed, it will bring more corruption and poverty', as people participate in a protest against the use of Bitcoin as legal tender, in San Salvador, El Salvador, September 7, 2021. REUTERS/Jose Cabezas

SAN SALVADOR, Sept 7 (Reuters) - More than 1,000 people marched in El Salvador's capital on Tuesday to protest the adoption of bitcoin as legal tender, amid a bumpy initial rollout of systems to support the digital currency.

The protesters burned a tire and set off fireworks in front of the Supreme Court building around noon local time, as the government deployed heavily militarized police to the site of the protest.

""This is a currency that's not going to work for pupusa vendors, bus drivers or shopkeepers,"" said a San Salvador resident who opposed the adoption of the cryptocurrency. Pupusas are a traditional Salvadoran corn-based food.

Register now for FREE unlimited access to Reuters.com Register

""This is a currency that's ideal for big investors who want to speculate with their economic resources.""

The protest came as El Salvador's government was rushing to iron out technological snags in bitcoin's first-day rollout.

Earlier on Tuesday, Salvadorans trying to download the Chivo digital wallet found it was unavailable on popular app stores. Then Bukele tweeted that the government had temporarily unplugged it, in order to connect more servers to deal with demand.

A group of people in Chivo tee-shirts at a stall to train people interested in using the app milled around waiting for it to be reconnected.

It later appeared on Apple and Huawei's stores, and Bukele used Twitter to ask users to let him know how it was working.

Polls indicate many Salvadorans are wary of the volatility of the cryptocurrency, which can shed hundreds of dollars in value in a day. That view is shared by many economists worried at how it will affect economic stability.

However, others have embraced it as a way ordinary people in a poor country can invest in financial markets.

Ahead of the launch, El Salvador bought 400 bitcoins worth around $20 million, Bukele said, helping drive the price of the currency above $52,000 for the first time since May. Hours later, however, bitcoin had weakened and last traded down 8.84% at $47,327.32. L8N2Q927A

Register now for FREE unlimited access to Reuters.com Register

Reporting by Wilfredo Pineda, writing by Laura Gottesdiener; Editing by Frank Jack Daniel and Alistair Bell

Our Standards: The Thomson Reuters Trust Principles.",2021-09-07 00:00:00,https://www.reuters.com/world/americas/salvador-street-protest-breaks-out-against-bitcoin-adoption-2021-09-07/,4
