title,text,publish_date,url,id
Turkey university protests not over despite rector's dismissal,"Students gather to protest against what they say is government interference in academia despite President Tayyip Erdogan's ousting of Melih Bulu, a rector whose appointment in January triggered months of demonstrations, in Istanbul, Turkey, July 16, 2021. The banner reads ""All the government-appointed trustees at municipalities and universities will go"". REUTERS/Umit Bektas

ISTANBUL, July 16 (Reuters) - Turkish students and academics are set to continue protests against what they say is government interference in academia despite President Tayyip Erdogan's ousting of a rector whose appointment in January triggered months of demonstrations.

Students and teachers at Istanbul's Bogazici University have defied a government ban on protests since Erdogan installed the rector Melih Bulu, an academic and former political candidate, saying the appointment process was undemocratic.

Protesters have clashed with police and hundreds have been arrested during the demonstrations. Erdogan had described them as ""terrorists"" and said he would not allow the unrest to grow into anti-government protests. read more

Register now for FREE unlimited access to Reuters.com Register

After Bulu's surprise dismissal was announced in a presidential decree on Thursday, his deputy Naci Inci has provisionally taken over the role of rector.

Faculty members have been protesting on campus for months, regularly gathering with their backs turned to the rector's building.

Zeynep Gambetti, associate professor of political theory at Bogazici, said Bulu's dismissal was a result of protests but that it did not mean government pressure on the university would cease.

""We were not protesting against Melih Bulu's person. We were against the method of appointment and that he was chosen not through merit but loyalty,"" she said.

""We will continue to request the resignation of all administrative staff that were appointed, including the deputy rectors,"" Gambetti said.

She added protests would continue until a rector was chosen by university members, academic freedoms were secured and the presidential power to appoint a rector was revoked.

Faculty members would work to choose their own candidate, Gambetti added.

An activist group named ""Bogazici Solidarity"" said nothing had changed and listed grievances beyond the university, including other appointments of state officials in place of elected representatives and the dismissal of various academics.

A group of around 150 protesters later gathered in Istanbul's Kadikoy district, chanting ""this is just the beginning, the struggle continues"", among other slogans.

""The struggle continues for a sovereign democratic university,"" and ""We want the king, not the pawn"", two of their signs read.

NEW FACULTIES

A pro-government commentator cited unnamed sources as saying the High Education Board had unanimously sought Bulu's dismissal and Ankara felt he failed to carry out desired steps, notably setting up law and communication faculties.

""As a Bogazici alumnus, I am concerned about the possibility of a harsher a more hawkish rector being appointed,"" commentator Nagehan Alci wrote in a column in Haberturk newspaper.

Another decree by Erdogan in February to launch new Bogazici faculties brought a legal challenge from academics concerned about political intervention in the institution's autonomy.

In Friday's Official Gazette, the Bogazici rector's office sought three teaching staff for the new law faculty in a recruitment advertisement.

The move came after a Bogazici senate meeting on July 7 voted against appointing members to the faculty, according to a record of that meeting.

Later on Friday, provisional rector Inci dismissed Can Candan, a documentary filmmaker and academic who had been outspoken during the protests.

Among the reasons for the dismissal was a disciplinary investigation over posts that allegedly insulted the university's administrators, according to a letter from Inci shared by Candan on Twitter.

It also said Candan had not applied to be re-appointed to his position after his term ended on Thursday.

Register now for FREE unlimited access to Reuters.com Register

Additional reporting by Umit Bektas; Editing by Jonathan Spicer, Raissa Kasolowsky and Alex Richardson

Our Standards: The Thomson Reuters Trust Principles.",2021-07-16 00:00:00,https://www.reuters.com/world/middle-east/turkey-university-protests-not-over-activists-say-2021-07-16/,65
Hungarians protest against planned Chinese university campus,"BUDAPEST, June 5 (Reuters) - Thousands of Hungarians, some of them holding banners declaring “Treason”, protested on Saturday against a Chinese university’s plans to open a campus in Budapest.

Liberal opponents of nationalist Prime Minister Viktor Orban accuse him of cosying up to China, and fear the campus could undercut the quality of higher education and help Beijing increase its influence in Hungary and the European Union.

""I do not agree with our country's strengthening feudal relationship with China,"" Patrik, a 22-year-old student who declined to give his full name, said at the protest in the Hungarian capital.

Register now for FREE unlimited access to Reuters.com Register

He said funds should be used ""to improve our own universities instead of building a Chinese one.""

The government signed an agreement with Shanghai-based Fudan University in April on building the campus at a site in Budapest where a dormitory village for Hungarian students had previously been planned.

The government has said Fudan is a world-class institution and the campus would ""allow students to learn from the best.""

1/8 Demonstrators protest against the planned Chinese Fudan University campus in Budapest, Hungary, June 5, 2021. REUTERS/Bernadett Szabo Read More

MTI news agency quoted Tamas Schanda, a deputy government minister, as saying Saturday's protest was unnecessary and dismissing ""political hysteria"" based on unfounded gossip and media reports.

Opposition politicians and economists have criticised what they say will be the high costs of the project and a lack of transparency. Budapest's mayor opposes the plan.

""Fidesz is selling out wholesale the housing of Hungarian students, and their future, just so it can bring the elite university of China's dictatorship into the country,"" the organisers of Saturday's protest said on Facebook.

Beijing said this week ""a few Hungarian politicians"" were trying to grab attention and obstruct cooperation between China and Hungary.

Orban has built cordial ties with China, Russia and other illiberal governments, while locking horns with Western allies by curbing the independence of scientific research, the judiciary and media.

He faces a unified opposition for the first time since assuming power in 2010 before a parliamentary election due in 2022.

Register now for FREE unlimited access to Reuters.com Register

Editing by Timothy Heritage

Our Standards: The Thomson Reuters Trust Principles.",2021-06-05 00:00:00,https://www.reuters.com/world/china/hungarians-protest-against-planned-chinese-university-campus-2021-06-05/,66
Thousands protest in Chicago as NATO summit opens,"CHICAGO (Reuters) - Thousands of protesters carried their anti-war message to world leaders at a NATO summit on a steamy Sunday, in a mostly peaceful march led by a group of Iraq War veterans who symbolically gave back their military medals.

Protesters holding an American flag march over a bridge during an anti-NATO protest march in Chicago May 19, 2012. REUTERS/ Darren Hauck

During the march, a group of black-clad demonstrators darted toward police lines along the route, and some threw water bottles at officers who pushed back and yelled at them to move along, but there were no major incidents.

Police estimated the crowd at 2,500 to 3,000 people, although it appeared to be larger, in what was the biggest rally so far in the week leading up to the NATO summit. Among them was Chicago-based civil rights leader Rev. Jesse Jackson, who walked in summer-like heat with a few women bearing a sign reading “Afghans for Peace.”

Riot police made a bigger show of force and watched the march closely than earlier in the week. They were also more open in displaying their equipment including body armor.

Demonstrators ranged from those in festive costumes and a few parents pushing strollers with babies to others in all black with bandannas over their faces and carrying signs including “Anarchists alliance, D.C.”

Demonstrators had little chance of being seen by the world leaders and representatives from some 60 countries at the meeting of the military alliance. The summit site, the McCormick Place convention center, is inside a security zone guarded by tall fences. Protesters were kept blocks away from the convention center.

President Barack Obama, who is hosting the summit in his hometown, kicked off the meeting by greeting NATO members one by one. NATO leaders are seeking to chart a path out of the unpopular war in Afghanistan.

The Coalition Against NATO-G8, the group behind Sunday’s parade that they hoped would draw 10,000 people, advocated for an immediate end to the U.S. role in the Afghan war.

Other protesters, including participants in Occupy Wall Street demonstrations from around the nation who descended on Chicago for the summit, decried U.S. defense spending and economic inequality.

The protesters hoisted flags and signs, including one pink hand-painted sign shaped like a woman’s torso reading “Bust Up NATO.” A woman fanned herself in the midday 90-degree (32 C) heat with a “No War, No Peace” sign.

In a brief skirmish, some black-clad, bandanna-wearing protesters pushed and screamed at police.

Some of the black-clad youths yelled at a group of veterans folding a flag, chanting “Burn it!” Some of the youths tussled with other protesters who blocked their path.

Some protesters carried large U.S. flags, some held upside down. Groups of drummers pounded away and Occupy Chicago anti-Wall Street protesters wore clown makeup.

Slideshow ( 8 images )

At the outskirts of the protest rally, police clambered out of vans and buses. Dozens of officers on bicycles that have been employed extensively against protests so far this past week were at the ready.

Matt Howard, a former U.S. Marine who served in Iraq, was one of more than three dozen veterans who threw his service medal onto the street near the summit site in a symbol of protest.

Vietnam War veteran Ron McSheffery, 61, said, “I’m in total support of stopping NATO and stopping the slaughter of innocent civilians. If we took the money we spent on bombs and put it into green energy, we wouldn’t need to keep the sea lanes open” for oil transport.

POLICE READY FOR PROTESTS

Previous protests in the run-up to the summit Sunday and Monday have been lively but peaceful, resulting in fewer than two dozen arrests in the past six days, according to the Chicago Police Department.

“I think we’re going to be able to handle it,” Police Chief Garry McCarthy told reporters, adding the numbers of demonstrators this week were fewer than many had expected.

“We’re going to take care of business. We’re well-trained, we’re well-equipped. I’ll say this again - we’re just not going to tolerate illegal behavior.”

One officer suffered a concussion Saturday when the police van he was driving was engulfed by a downtown protest. A protester also was hurt when the van sped off.

Five men have been arrested on terrorism-related or bomb-making charges. Three of those charged were plotting to attack Obama’s campaign headquarters, police stations and other targets, according to court documents. Defense lawyers said the three were entrapped by police informants.

An affiliate of the computer hacking group Anonymous said it had brought down the website for Chicago’s police department and another city website to protest the summit. The websites were back up a few hours later.

Fears that violence would erupt have so far proved unfounded as police have absorbed torrents of verbal abuse screamed at them by protesters. Experts credited the low arrest numbers to restraint by both police and protesters.

McCarthy said at the beginning of the week that his goal was to “extract” those protesters who were provocative and let others demonstrate peacefully.",2012-05-20 00:42:56,https://www.reuters.com/article/us-nato-summit-protests-idUSBRE84I09X20120520,67
Greenpeace protests against France's uranium exports to Russia,"Demonstrators protest outside an Orano office in Chatillon, France October 12, 2021. Victor Point / Greenpeace/Handout via REUTERS

PARIS, Oct 11 (Reuters) - Greenpeace activists protested outside the headquarters of one of France's state-owned nuclear companies on Tuesday, calling for the country to stop all exporting and plans to export its reprocessed uranium to Russia.

Environmental activists sat in hazmat suits beside dummy radioactive waste containers in front of Orano's offices just south of Paris, in a photo Greenpeace shared on Twitter.

They carried banners reading ""Nuclear is not green"", ""Stop radioactive trafficking"" and ""Russia is not a bin"".

Register now for FREE unlimited access to Reuters.com Register

In a statement, the group called for France's environment ministry to reclassify reprocessed uranium as waste and organise its long-term storage in France - rather than shipping the stocks to a site in Siberia for conversion into nuclear fuel.

Citing France and Russia's existing uranium reserves, Greenpeace said the reprocessed material could be stored for an ""unlimited time"" in Siberia where it may cause environmental harm.

Nuclear reprocessing is the chemical separation of products from spent nuclear fuel, which generates reusable uranium and plutonium that can be used in power plants and nuclear weapon projects.

New uranium was for years a cheaper alternative to the reprocessing and re-enriching of used uranium.

Greenpeace said most of the uranium sent to Russia would stay there without being reused, and that transporting the nuclear material was ""environmental, social and economic nonsense"".

Orano said it had sold just over 1,000 tonnes of reprocessed uranium to Russian state nuclear firm Rosatom late last year for conversion into fuel.

It stressed that the material was reusable and that higher natural uranium prices now made conversion more attractive.

EDF (EDF.PA), which signed a deal with Rosatom's subsidiary Tenex in 2018, said it would not send its first shipments before it received guarantees the site there respected ""technical and environmental"" requirements.

The materials would be converted to fuel in Russia before being sent back to EDF's own nuclear plants in France.

France derives around 70% of its power from some 56 working nuclear reactors, though the government aims to cut this to 50% by 2035.

Register now for FREE unlimited access to Reuters.com Register

Reporting by Benjamin Mallet; writing by Sarah Morland; Editing by Steve Orlofsky

Our Standards: The Thomson Reuters Trust Principles.",2021-10-12 00:00:00,https://www.reuters.com/business/environment/greenpeace-protests-against-frances-uranium-exports-russia-2021-10-12/,68
Thousands in El Salvador join protests against Bukele government,"SAN SALVADOR, Oct 17 (Reuters) - Thousands of people in El Salvador took to the streets on Sunday in protest against President Nayib Bukele who has stoked concern that he is steadily concentrating power and who responded with changing his Twitter profile late in the day to ""Emperor of El Salvador"".

Local media estimated at least 4,000 people marched through capital San Salvador. They bore banners and signs decrying Bukele's ouster of Supreme Court judges, the potential for the president to seek a second consecutive term and the adoption of bitcoin as legal tender.

Bukele's apparent joke with his Twitter profile follows an update last month when he changed it to say ""Dictator"" of El Salvador.

Register now for FREE unlimited access to Reuters.com Register

Sunday's protesters chanted slogans including ""What does El Salvador want? Get rid of the dictator!"" Near the capital's main square, some set fire to an effigy bearing the likeness of the 40-year-old president.

It was at least the second large protest in just over a month, following marches in September that denounced bitcoin being made legal tender alongside the U.S. dollar.

1/5 People take part in a protest against actions by the government of El Salvador's President Nayib Bukele, as the use of bitcoin and legal reforms to extend his term, in San Salvador, El Salvador October 17, 2021. REUTERS/Jose Cabezas Read More

In May, a Congress dominated for the first time by Bukele's New Ideas party voted to fire the judges on the constitutional panel of the Supreme Court, among the most senior jurists in the country, as well as the then-attorney general. Replacements seen as friendly to Bukele were swiftly voted in to replace them, which generated harsh criticism from the United States as well as top international rights groups.

Bukele's administration then came under fire from the United States after the Supreme Court judges ruled that the president could seek a second consecutive term, which Washington saw as unconstitutional.

""We are totally losing rights because today they do not respect the laws. Here, what's done is the will of Nayib,"" said Rosa Granados, a labor union member who participated in the protests.

""If he raises his hand, all the deputies approve it and there is no law and no legal process that is respected,"" she added.

Bukele, a seasoned and often provocative user of social media, dismissed the protests as a ""failure"" on Twitter.

""The march is a failure and they know it..... Nobody believes them here anymore,"" he wrote.

Register now for FREE unlimited access to Reuters.com Register

Reporting by Nelson Renteria, writing by Cassandra Garrison, Editing by Nick Zieminski and Edwina Gibbs

Our Standards: The Thomson Reuters Trust Principles.",2021-10-17 00:00:00,https://www.reuters.com/world/americas/thousands-protest-el-salvador-against-bukele-government-2021-10-17/,69
Three dead after anti-Taliban protests in Jalalabad-witnesses,"Aug 18 (Reuters) - Three people were killed and more than a dozen injured after Taliban militants opened fire during protests against the group in the Afghan city of Jalalabad on Wednesday, two witnesses told Reuters.

A Taliban source said one person had been killed in the city, some 150 km (90 miles) to the east of Kabul.

The witnesses said the shooting followed an attempt by local residents to install Afghanistan's national flag at a square in Jalalabad. read more

Register now for FREE unlimited access to Reuters.com Register

Video footage shot by Pajhwok Afghan News, a local news agency, showed protesters in the city who were carrying the Afghan flag fleeing with the sound of gunshots in the background.

1/3 People carry Afghan flags as they take part in an anti-Taliban protest in Jalalabad, Afghanistan August 18, 2021 in this screen grab taken from a video. Pajhwok Afghan News/Handout via REUTERS Read More

A former police official told Reuters separately that four people had been killed and 13 injured in the protests, without giving further details.

It was not immediately possible to verify how the deaths occurred.

""There were some troublemakers who wanted to create issues for us,"" a Taliban militant present in Jalalabad at the time of the incident told Reuters. ""These people are exploiting our relaxed policies.""

Taliban spokesmen could not immediately be reached for comment.

Register now for FREE unlimited access to Reuters.com Register

Reporting by Jibran Ahmad in Peshawar and Rupam Jain in Mumbai; Writing by Alasdair Pal; Editing by Timothy Heritage

Our Standards: The Thomson Reuters Trust Principles.",2021-08-18 00:00:00,https://www.reuters.com/world/india/least-three-dead-following-anti-taliban-protests-jalalabad-witnesses-2021-08-18/,70
