title,text,publish_date,url,id
Special Report: Iran’s leader ordered crackdown on unrest - 'Do whatever it takes to end it',"(Reuters) - After days of protests across Iran last month, Supreme Leader Ayatollah Ali Khamenei appeared impatient. Gathering his top security and government officials together, he issued an order: Do whatever it takes to stop them.

That order, confirmed by three sources close to the supreme leader’s inner circle and a fourth official, set in motion the bloodiest crackdown on protesters since the Islamic Revolution in 1979.

About 1,500 people were killed during less than two weeks of unrest that started on Nov. 15. The toll, provided to Reuters by three Iranian interior ministry officials, included at least 17 teenagers and about 400 women as well as some members of the security forces and police.

The toll of 1,500 is significantly higher than figures from international human rights groups and the United States. A Dec. 16 report by Amnesty International said the death toll was at least 304. The U.S. State Department, in a statement to Reuters, said it estimates that many hundreds of Iranians were killed, and has seen reports that number could be over 1,000.

The figures provided to Reuters, said two of the Iranian officials who provided them, are based on information gathered from security forces, morgues, hospitals and coroner’s offices.

The government spokesman’s office declined to comment on whether the orders came from Khamenei and on the Nov. 17 meeting. Iran’s mission to the United Nations did not respond to a request for comment for this story.

In a statement Monday following publication of this article, a spokesman for Iran’s Supreme National Security Council described the death toll figure as “fake news,” according to semi-official Tasnim news agency.

What began as scattered protests over a surprise increase in gasoline prices quickly spread into one of the biggest challenges to Iran’s clerical rulers since the 1979 Islamic Revolution.

By Nov. 17, the second day, the unrest had reached the capital Tehran, with people calling for an end to the Islamic Republic and the downfall of its leaders. Protesters burned pictures of Khamenei and called for the return of Reza Pahlavi, the exiled son of the toppled Shah of Iran, according to videos posted on social media and eye witnesses.

That evening at his official residence in a fortified compound in central Tehran, Khamenei met with senior officials, including security aides, President Hassan Rouhani and members of his cabinet.

At the meeting, described to Reuters by the three sources close to his inner circle, the 80-year-old leader, who has final say over all state matters in the country, raised his voice and expressed criticism of the handling of the unrest. He was also angered by the burning of his image and the destruction of a statue of the republic’s late founder, Ayatollah Ruhollah Khomeini.

“The Islamic Republic is in danger. Do whatever it takes to end it. You have my order,” the supreme leader told the group, one of the sources said.

Khamenei said he would hold the assembled officials responsible for the consequences of the protests if they didn’t immediately stop them. Those who attended the meeting agreed the protesters aimed to bring down the regime.

“The enemies wanted to topple the Islamic Republic and immediate reaction was needed,” one of the sources said.

The fourth official, who was briefed on the Nov. 17 meeting, added that Khamenei made clear the demonstrations required a forceful response.

Slideshow ( 9 images )

“Our Imam,” said the official, referring to Khamenei, “only answers to God. He cares about people and the Revolution. He was very firm and said those rioters should be crushed.”

Tehran’s clerical rulers have blamed “thugs” linked to the regime’s opponents in exile and the country’s main foreign foes, namely the United States, Israel and Saudi Arabia, for stirring up unrest. Khamenei has described the unrest as the work of a “very dangerous conspiracy.”

A Dec. 3 report on Iran’s state television confirmed that security forces had fatally shot citizens, saying “some rioters were killed in clashes.” Iran has given no official death toll and has rejected figures as “speculative.”

“The aim of our enemies was to endanger the existence of the Islamic Republic by igniting riots in Iran,” said the commander-in-chief of the elite Revolutionary Guards Corps, Hossein Salami, last month, according to Iranian media.

The Revolutionary Guards declined to comment for this report.

Iran’s interior minister said on Nov. 27 more than 140 government sites had been set on fire along with hundreds of banks and dozens of petrol stations, while 50 bases used by security forces were also attacked, according to remarks reported by Iran’s state news agency IRNA. The minister said up to 200,000 people took part in the unrest nationwide.

“SMELL OF GUNFIRE AND SMOKE”

For decades, Islamic Iran has tried to expand its influence across the Middle East, from Syria to Iraq and Lebanon, by investing Tehran’s political and economic capital and backing militias. But now it faces pressure at home and abroad.

In recent months, from the streets of Baghdad to Beirut, protesters have been voicing anger at Tehran, burning its flag and chanting anti-Iranian regime slogans. At home, the daily struggle to make ends meet has worsened since the United States reimposed sanctions after withdrawing last year from the nuclear deal that Iran negotiated with world powers in 2015.

The protests erupted after a Nov. 15 announcement on state media that gas prices would rise by as much as 200% and the revenue would be used to help needy families.

Within hours, hundreds of people poured into the streets in places including the northeastern city of Mashhad, the southeastern province of Kerman and the southwestern province of Khuzestan bordering Iraq, according to state media. That night, a resident of the city Ahvaz in Khuzestan described the scene by telephone to Reuters.

“Riot police are out in force and blocking main streets,” the source said. “I heard shooting.” Videos later emerged on social media and state television showing footage of clashes in Ahvaz and elsewhere between citizens and security forces.

The protests reached more than 100 cities and towns and turned political. Young and working-class demonstrators demanded clerical leaders step down. In many cities, a similar chant rang out: “They live like kings, people get poorer,” according to videos on social media and witnesses.

By Nov. 18 in Tehran, riot police appeared to be randomly shooting at protesters in the street “with the smell of gunfire and smoke everywhere,” said a female Tehran resident reached by telephone. People were falling down and shouting, she added, while others sought refuge in houses and shops.

Slideshow ( 9 images )

The mother of a 16-year-old boy described holding his body, drenched in blood, after he was shot during protests in a western Iranian town on Nov. 19. Speaking on condition of anonymity, she described the scene in a telephone interview.

“I heard people saying: ‘He is shot, he is shot,’” said the mother. “I ran toward the crowd and saw my son, but half of his head was shot off.” She said she urged her son, whose first name was Amirhossein, not to join the protests, but he didn’t listen.

Iranian authorities deployed lethal force at a far quicker pace from the start than in other protests in recent years, according to activists and details revealed by authorities. In 2009, when millions protested against the disputed re-election of hardline President Mahmoud Ahmadinejad, an estimated 72 people were killed. And when Iran faced waves of protests over economic hardships in 2017 and 2018, the death toll was about 20 people, officials said.

Khamenei, who has ruled Iran for three decades, turned to his elite forces to put down the recent unrest -- the Revolutionary Guards and its affiliated Basij religious militia.

A senior member of the Revolutionary Guards in western Kermanshah province said the provincial governor handed down instructions at a late-night emergency meeting at his office on Nov. 18.

“We had orders from top officials in Tehran to end the protests, the Guards member said, recounting the governor’s talk. “No more mercy. They are aiming to topple the Islamic Republic. But we will eradicate them.” The governor’s office declined to comment.

As security forces fanned out across the country, security advisors briefed Khamenei on the scale of the unrest, according to the three sources familiar with the talks at his compound.

The interior minister presented the number of casualties and arrests. The intelligence minister and head of the Revolutionary Guards focused on the role of opposition groups. When asked about the interior and intelligence minister’s role in the meeting, the government spokesman’s office declined to comment.

Khamenei, the three sources said, was especially concerned with anger in small working-class towns, whose lower-income voters have been a pillar of support for the Islamic Republic. Their votes will count in February parliamentary elections, a litmus test of the clerical rulers’ popularity since U.S. President Donald Trump exited Iran’s nuclear deal -- a step that has led to an 80% collapse in Iran’s oil exports since last year.

Squeezed by sanctions, Khamenei has few resources to tackle high inflation and unemployment. According to official figures, the unemployment rate is around 12.5% overall. But it is about double that for Iran’s millions of young people, who accuse the establishment of economic mismanagement and corruption. Khamenei and other officials have called on the judiciary to step up its fight against corruption.

“BLOOD ON THE STREETS”

Officials in four provinces said the message was clear -- failure to stamp out the unrest would encourage people to protest in the future.

A local official in Karaj, a working-class city near the capital, said there were orders to use whatever force was necessary to end the protests immediately. “Orders came from Tehran,” he said, speaking on condition of anonymity. “Push them back to their homes, even by shooting them.” Local government officials declined to comment.

Residents of Karaj said they came under fire from rooftops as Revolutionary Guards and police on motorcycles brandished machine guns. “There was blood everywhere. Blood on the streets,” said one resident by telephone. Reuters could not independently verify that account.

In Mahshahr county, in the strategically important Khuzestan province in southwest Iran, Revolutionary Guards in armored vehicles and tanks sought to contain the demonstrations. State TV said security forces opened fire on “rioters” hiding in the marshes. Rights groups said they believe Mahshahr had one of the highest protest death tolls in Iran, based on what they heard from locals.

“The next day when we went there, the area was full of bodies of protesters, mainly young people. The Guards did not let us take the bodies,” the local official said, estimating that “dozens” were killed.

The U.S. State Department has said it has received videos of the Revolutionary Guards opening fire without warning on protesters in Mahshahr. And that when protesters fled to nearby marshlands, the Guards pursued them and surrounded them with machine guns mounted on trucks, spraying the protesters with bullets and killing at least 100 Iranians.

Iran’s authorities dispute the U.S. account. Iranian officials have said security forces in Mahshahr confronted “rioters” who they described as a security threat to petrochemical complexes and to a key energy route that, if blocked, would have created a crisis in the country.

A security official told Reuters that the reports about Mahshahr are “exaggerated and not true” and that security forces were defending “people and the country’s energy facilities in the city from sabotage by enemies and rioters.”

In Isfahan, an ancient city of two million people in central Iran, the government’s vow to help low-income families with money raised from higher gas prices failed to reassure people like Behzad Ebrahimi. He said his 21-year-old nephew, Arshad Ebrahimi, was fatally shot during the crackdown.

“Initially they refused to give us the body and wanted us to bury him with others killed in the protests,” Ebrahimi said. “Eventually we buried him ourselves, but under the heavy presence of security forces.” Rights activists confirmed the events. Reuters was unable to get comment from the government or the local governor on the specifics of the account.",2019-12-23 04:07:03,https://www.reuters.com/article/us-iran-protests-specialreport-idUSKBN1YR0QR,23
"Three people shot dead during huge protests against Sudan coup, doctors say","Summary Thousands of protesters call for an end to military rule

Tight security in capital Khartoum

Burhan said he removed cabinet to avert civil war

KHARTOUM, Oct 30 (Reuters) - Security forces shot dead three people during nationwide protests in Sudan on Saturday, a doctors committee said, as hundreds of thousands of people demanded the restoration of a civilian-led government after a military coup.

In Khartoum, security forces used tear gas and gunfire to try to disperse a huge crowd after protesters had been setting up a stage and discussing the possibility of a sit-in, said a Reuters witness.

The Central Committee of Sudanese Doctors said three protesters were shot dead by security forces in the capital Khartoum's twin city of Omdurman. It said 38 people were injured, including some by gunfire.

Register now for FREE unlimited access to Reuters.com Register

An eyewitness in Omdurman said they heard gunshots and saw people being carried away bleeding from the direction of the parliament building.

Sudanese police denied shooting protesters during the demonstrations, saying on state TV that one policeman sustained gunshot wounds. A representative of the military was not immediately available to comment.

The demonstrations marked the biggest challenge to General Abdel Fattah al-Burhan since he ousted Prime Minister Abdalla Hamdok's cabinet on Monday.

""This has been a miscalculation from the start and misunderstanding of the level of commitment, bravery, and concern the street has about the future of Sudan,"" said Jonas Horner of the International Crisis Group.

Protesters carried Sudanese flags and chanted ""Military rule can't be praised"" and ""This country is ours, and our government is civilian"" as they marched in neighbourhoods across Khartoum.

People also took to the streets in cities in central, eastern, northern and western Sudan. Crowds swelled to the hundreds of thousands in Khartoum, said a Reuters witness.

""The people have delivered their message, that retreat is impossible and power belongs to the people,"" said protester Haitham Mohamed.

AID FROZEN

The United States and the World Bank have frozen assistance to Sudan, where an economic crisis has seen shortages of food and medicine and where nearly a third of the population are in need of urgent humanitarian support.

While Western states have denounced the coup, Sudan's regional allies Saudi Arabia, the United Arab Emirates and Egypt have emphasized the need for stability and security.

Saudi Foreign Minister Prince Faisal bin Farhan Al Saud told Reuters that the kingdom hopes all sides in Sudan can engage in a dialogue and chart a path forward.

1/6 Sudanese demonstrators march and chant during a protest against the military takeover, in Atbara, Sudan. Ebaid Ahmed via REUTERS Read More

Civilian-appointed cabinet ministers supported the protests in a statement, and said the military ""will not find free Sudanese or true democratic revolutionary forces to be their partners in power.""

In central Khartoum there was a heavy military deployment of armed troops that included the army and the paramilitary Rapid Support Forces.

Security forces had blocked roads leading to the defence ministry complex and the airport.

With Saturday's daths, at least 14 protesters have been killed in clashes with security forces this week, raising fears of a full-blown crackdown.

In local neighbourhoods, protest groups blocked roads overnight with stones, bricks, tree branches and plastic pipes to try to keep the security forces out.

NEIGHBOURHOOD RESISTANCE COMMITTEES

Unlike in previous protests, many people carried pictures of Hamdok, who remains popular despite an economic crisis that had worsened under his rule.

""Hamdok is supported by the people. If Hamdok takes the country that's okay,"" said Mohamed, a member of a neighbourhood resistance committee.

With internet and phone lines restricted by the authorities, opponents of the coup mobilised for the protest using fliers, SMS messages, graffiti, and neighbourhood rallies.

Neighbourhood-based resistance committees, active since the uprising against deposed President Omar al-Bashir that began in December 2018, have been central to organising despite the arrests of key politicians.

Protesters carried pictures of Burhan, his deputy General Mohamed Hamdan Dagalo, and Bashir covered in red.

Burhan has said he removed the cabinet to avert civil war after civilian politicians stoked hostility to the armed forces.

He says he is still committed to a democratic transition, including elections in July 2023.

""Rule is based on a combination of consent and coercion,"" said Sudanese analyst Magdi El Gizouli. ""Burhan has no consent and is unable to coerce the multitudes on the street into submission.""

Register now for FREE unlimited access to Reuters.com Register

Reporting by Khalid Abdelaziz in Khartoum, Nafisa Eltahir and Omar Fahmy in Cairo Additional reporting by Aziz El Yaakoubi in Dubai Writing by Nafisa Eltahir and Michael Georgy Editing by Stephen Coates, Frances Kerry and Toby Chopra

Our Standards: The Thomson Reuters Trust Principles.",2021-10-29 00:00:00,https://www.reuters.com/world/africa/sudanese-set-nationwide-protests-against-military-coup-2021-10-29/,24
Oman orders speedier job creation amid protests over unemployment,"Sultan Haitham bin Tariq al-Said gives a speech after being sworn in before the royal family council in Muscat, Oman January 11, 2020. REUTERS/Sultan Al Hasani

Summary Omanis protest for third consecutive day

Protests pose challenge for new sultan

Oman introduced new tax to fix state finances

Markets unaffected, Oman CDS unchanged

DUBAI, May 25 (Reuters) - Groups of Omanis demanding jobs held fresh protests on Tuesday, activists said, in the biggest challenge yet to the Gulf state's new ruler, who ordered the government to accelerate plans to create thousands of jobs.

Social media postings showed a group of protesters holding a sit-in under a bridge in the northern city of Sohar, where protests have taken place for three consecutive days. Other protests were reported in several other towns, including Rustaq, Nizwa and Sur.

Videos and photos showed security forces serving water to protesters, a change of approach from Monday's demonstrations when police fired tear gas to disperse gatherings and arrested groups of protesters. read more

Register now for FREE unlimited access to Reuters.com Register

Sultan Haitham, who acceded to the throne last year after the death of Sultan Qaboos, has had to bring in austerity measures to ease pressure on public finances at a time of low oil prices.

The government did not comment on Tuesday's protests. Oman's state television showed the sultan chairing a meeting on youth employment.

""The youth are the nation's wealth, its unfailing resource ... We will make sure we listen to them, sense their needs, interests and aspirations,"" Sultan Haitham said.

The sultan also announced new directives to create up to 32,000 full and part-time government jobs, according to Oman's state news agency. These will include government subsidies for those entering the workforce for the first time.

The economy of Oman, a relatively small energy producer with high levels of debt, is vulnerable to swings in oil prices and external shocks such as the coronavirus pandemic.

The protests follow the introduction last month of a value-added tax (VAT) for the first time, one of a series of reforms aimed at ensuring the sultanate’s financial sustainability.

Oman has pushed forward its programme of replacing foreign workers with Omani citizens to ease pressure on the job market but youth unemployment is relatively high at over 10%.

""The authorities may choose to postpone the implementation of some of the planned fiscal measures to maintain socioeconomic stability, especially if oil prices rise enough to reduce pressure on the budget,"" said Zahabia Gupta, an analyst at S&P Global Ratings.

The International Monetary Fund has estimated Oman's gross external debt will go down to around 112% of gross domestic product this year from 127% of GDP last year.

Rachna Uppal, director of research at Azure Strategy, said Oman has committed to diversifying its income stream away from hydrocarbons but there are headwinds on the horizon.

""The slow pace of reforms and increased austerity measures combined with the ongoing uncertainty over the pandemic is testing popular patience ... if protests continue or spread wider, it could spook investors at a critical time for Oman,"" she said.

Markets so far appeared to have shrugged off the protests, with Oman credit default swaps – a measure of sovereign default risk – unchanged on Tuesday, according to IHS Markit data.

""Seeing where oil prices are and Oman’s move early in the year to fund the deficit - it already raised $4.35 billion out of its $5 billion external funding need – there are no major concerns in the market"" said Zeina Rizk, a fixed income fund manager at Dubai-based Arqaam Capital.

Register now for FREE unlimited access to Reuters.com Register

Reporting by Aziz El Yaakoubi and Davide Barbuscia; Editing by Giles Elgood

Our Standards: The Thomson Reuters Trust Principles.",2021-05-25 00:00:00,https://www.reuters.com/world/middle-east/job-seeking-omanis-protest-again-press-cash-strapped-government-2021-05-25/,25
"Mexicans protest journalist killings, call for protection","MEXICO CITY, Jan 25 (Reuters) - Mexican journalists on Tuesday started nationwide protests to denounce the recent murders of three reporters, demanding an end to impunity that has often characterized the killings of their colleagues.

The protests follow the murder of seasoned journalist Lourdes Maldonado on Sunday, some three years after she raised the issue of killings with President Andres Manuel Lopez Obrador and said she feared for her life. read more

Protesters in the central state of Puebla laid flowers and candles on the street along with signs that read ""I'm angry at censorship"", television footage showed, while in the northern state of Chihuahua protesters scrawled on a wall ""Journalism is a risk"" and drew the face of Maldonado.

Register now for FREE unlimited access to Reuters.com Register

Israel Ibarra, president at a Baja California communications college, said if government and society failed to act they would be ""complicit"" not only in the murders of Maldonado and others but ""the murder of freedom of expression in Mexico"".

Mexico is one of the world's most dangerous countries for journalists, and some 145 have been killed between 2000-2021, according to Article 19, an advocacy group.

1/5 Mexican journalists gather around pictures of colleagues who have been murdered as they protest the recent killings of photojournalist Margarito Martinez and journalist Lourdes Maldonado, in Veracruz, Mexico January 25, 2022. REUTERS/Yahir Ceballos Read More

Mexican journalist networks voted to stage the gatherings, which will coincide with online protest campaigns.

""It is matter of urgency that state and federal authorities prevent attacks, protect journalists when they are victims, and investigate crimes committed against the press with due diligence,"" Article 19 said in a statement.

Maldonado's murder in the northern border city of Tijuana, where she worked for many years, followed the killings of two other Mexican journalists this month.

Lopez Obrador, who has been criticized for not doing more to protect reporters, said his government would investigate and ""clear up this crime to prevent further murders of journalists"".

Critics say Lopez Obrador has failed to deliver on pledges to reduce violence, combat deeply entrenched organized crime, or reduce impunity. The president says crime and violence are the products of chronic corruption and inequality.

Register now for FREE unlimited access to Reuters.com Register

Reporting by Ana Isabel Martinez, Lizbeth Diaz and Daina Beth Solomon Editing by Drazen Jorgic and David Gregorio

Our Standards: The Thomson Reuters Trust Principles.",2022-01-25 00:00:00,https://www.reuters.com/world/americas/mexican-reporters-plan-nationwide-protests-over-journalist-killings-2022-01-25/,26
